{
  "id": "sec_conformance_001",
  "protected_type": "secret",
  "value_kind": "token",
  "label": "production API token",
  "sensitivity": "restricted",
  "namespace": "default",
  "scope": [
    "project",
    "repo:oacs"
  ],
  "owner_actor_id": "act_human_001",
  "ciphertext": "base64:encrypted-secret-payload",
  "nonce": "base64:example-nonce",
  "aad": "protected:sec_conformance_001",
  "key_ref": "local-master-key",
  "metadata": {
    "provider": "example",
    "allowed_tools": [
      "tool_conformance_http_lookup"
    ]
  },
  "content_hash": "sha256:redacted-secret-record",
  "created_at": "2026-05-03T00:00:00Z",
  "updated_at": "2026-05-03T00:00:00Z",
  "rotated_at": null,
  "expires_at": null,
  "status": "active"
}
